{
  "schemaVersion": 1,
  "packageName": "com.feimo.astralpartyjpn",
  "gameVersion": "3.2.0",
  "downloadUrl": "https://github.com/maynut02/astral-party-korean-patch/releases/download/int-android-v3.2.0/AstralParty_INT_ANDROID.apk",
  "sha256": "0ea65da0cf94d9cfd1dbc244f0689087c2a83de5abc9b5f177203b4ef26458b3",
  "size": 123397880,
  "installerPackageName": "com.android.vending"
}
